{"format":"folkly-translation-v1","slug":"ui-privacy","locale":"ja","sourceHash":"8e2f45d826cf3881a5f07e8e84c9d9023c2025646c69992f2ef3a00952d80b94","glossaryHash":"cc47218883939911ed62c5ed9601d828e2f83ff73ba3ce5b90d6bd7c910f796a","promptVersion":"faithful-public-segments-v1","fallbackLabel":"このページは英語でもご覧いただけます。","segments":[{"id":"s0001","text":"プライバシーポリシー | Folkly"},{"id":"s0002","text":"Folkly での購読、お問い合わせ、Cookie、プライバシーに関する選択の取り扱いについて。"},{"id":"s0003","text":"folkly"},{"id":"s0004","text":"プライバシーポリシー"},{"id":"s0005","text":"2026年10月8日より有効。Folkly は Then Media inc. のプロジェクトです。お問い合わせ:"},{"id":"s0006","text":"noah@then.tv"},{"id":"s0007","text":"プライバシーに関するご質問やご要望はこちらまで。"},{"id":"s0008","text":"ご提供いただく情報"},{"id":"s0009","text":"購読では、週刊のストーリー配信のためにメールアドレス、同意の記録、購読の状況を収集します。お問い合わせフォームでは、回答のために氏名、メールアドレス、ご用件、メッセージ、寄稿への関心を収集します。機密性の高い個人情報はフォームに入力しないでください。お問い合わせいただいても、ニュースレターの購読にはなりません。"},{"id":"s0010","text":"情報の保存と利用について"},{"id":"s0011","text":"購読者およびお問い合わせの記録は、Vercel Blob のプライベートストレージに保存されます。Vercel がサイトをホストし、配信と保護のためにリクエストに関する運用情報を処理します。Supabase が所有者の認証と非公開の編集ストレージを提供します。Resend は設定済みのニュースレター配信プロバイダーであり、配信はその有効化と確認済みの送信者設定に依存します。これらのプロバイダーはそれぞれのサービスに必要な情報を処理します。クレジット付き画像の一部は Wikimedia の画像サーバー経由で配信され、表示に必要なリクエストがそのサーバーに送られます。出典や音楽への外部リンクは、それぞれのサイトのプライバシー方針に従います。購読者やお問い合わせの記録を Google Analytics や広告タグに提供することはありません。"},{"id":"s0012","text":"Cookie、アナリティクスと広告"},{"id":"s0013","text":"サインインに必要不可欠な Cookie が、所有者専用エリアを支えます。ブラウザのローカル設定により、オプション Cookie に関するあなたの選択が最大180日間保存されます。Google Analytics（GA4）は、アナリティクスを許可した場合にのみ読み込まれ、訪問と操作を測定し、識別子や Cookie を使用することがあります。URL のクエリ文字列とフラグメントは、初期のページビュー設定から除外しています。アナリティクスは所有者パネルでは読み込まれません。サイトのアナリティクス設定で、Google シグナルと広告のパーソナライゼーション信号を無効にしています。"},{"id":"s0014","text":"広告スクリプトは現在、認定済み同意プロバイダーの設定を待ってブロックされています。Google 広告が有効になった場合、Google および開示された他の広告パートナーは、該当するあなたの選択に従い、このサイトや他のサイトへの過去の訪問に基づく広告を配信するために Cookie を使用することがあります。このポリシーと同意インターフェイスは、有効化の前に更新が必要です。参照:"},{"id":"s0015","text":"Google がパートナーサイトの情報をどのように使用するか"},{"id":"s0016","text":"および"},{"id":"s0017","text":"Google の広告に関する選択"},{"id":"s0018","text":"。"},{"id":"s0019","text":"あなたの選択"},{"id":"s0020","text":"公開ページの「プライバシー設定」で、オプション Cookie の拒否やアナリティクスの同意の変更ができます。拒否してもジャーナルは引き続きご利用いただけます。同意を撤回するとページが再読み込みされ、サイトのアナリティクスタグが停止し、アクセス可能なアナリティクス Cookie の削除が試みられます。すでに Google が処理したデータを消去することはできません。このサイトは、Global Privacy Control シグナルが存在する場合も含め、広告を無効のままにしています。配信が有効な場合、ニュースレターのメールには配信停止へのリンクが含まれます。上記のアドレス宛てにメールで、ご自身が提供した情報へのアクセス、訂正、削除を請求できます。記録を開示する前に、請求の確認を行う場合があります。"},{"id":"s0021","text":"保存と保護"},{"id":"s0022","text":"購読者の記録は、購読が有効な間保存されます。配信停止の要望に応じるため、最低限の抑制情報を保持することがあります。お問い合わせと編集の記録は、その目的に必要な間、削除の要望と正当なセキュリティ・法的必要性に従って保存されます。現在、自動削除のスケジュールは実装されていません。非公開の記録へのアクセスを制限していますが、いかなるオンラインシステムも完全に安全であるとは保証できません。プロバイダーはあなたの国以外で情報を処理することがあります。"},{"id":"s0023","text":"所有者エディターチャット"},{"id":"s0024","text":"所有者のプライベートなワークスペースは、記事のアイデアと編集上の会話を Vercel Blob のプライベートストレージに保存します。エディターチャットが有効で使用された場合、所有者のメッセージと直近の限られた会話履歴が、返答の生成のために OpenAI に送信されます。公開フォームの送信内容がこれらの会話に自動的に含まれることはありません。"},{"id":"s0025","text":"子どもと変更について"},{"id":"s0026","text":"本ジャーナルは一般向けであり、13歳未満の子どもから意図的に個人情報を収集することはありません。子どもが情報を提供した場合はご連絡ください。運用が変わった際にはこのページを更新し、同意ポリシーが変わった際にはオプション Cookie について改めて選択をお願いします。"},{"id":"s0027","text":"プライバシーポリシー"},{"id":"s0028","text":"・"},{"id":"s0029","text":"プライバシー設定"},{"id":"s0030","text":"あなたのプライバシーに関する選択"},{"id":"s0031","text":"必須のストレージはサインインを支え、これらの選択を記憶します。オプションのアナリティクスは、このジャーナルがどのように使われているかを理解するのに役立ちます。広告は現在オフになっています。"},{"id":"s0032","text":"プライバシーポリシーを読む"},{"id":"s0033","text":"Google Analytics を許可する"},{"id":"s0034","text":"認定済みの同意プロバイダーが設定されるまで、広告はオフのままになります。"},{"id":"s0035","text":"アナリティクスを許可"},{"id":"s0036","text":"オプションの cookie を拒否"},{"id":"s0037","text":"設定を管理"},{"id":"s0038","text":"設定を保存"}]}