{"format":"folkly-translation-v1","slug":"ui-subscribe","locale":"es","sourceHash":"733af746dd178eeed2374039dd8abfa12e01ae806d869de50ab7721115d03e97","glossaryHash":"cc47218883939911ed62c5ed9601d828e2f83ff73ba3ce5b90d6bd7c910f796a","promptVersion":"faithful-public-segments-v1","fallbackLabel":"Esta página también está disponible en inglés.","segments":[{"id":"s0001","text":"Suscríbete | Folkly"},{"id":"s0002","text":"Recibe un correo semanal con nuevas historias sobre la intersección de la cultura y el lugar."},{"id":"s0003","text":"Folkly, inicio"},{"id":"s0004","text":"folkly"},{"id":"s0005","text":"La revista Folkly"},{"id":"s0006","text":"Cultura, entregada."},{"id":"s0007","text":"Recibe un correo semanal con nuevas historias sobre la intersección de la cultura y el lugar."},{"id":"s0008","text":"Correo electrónico"},{"id":"s0009","text":"tu@ejemplo.com"},{"id":"s0010","text":"Deja este campo vacío"},{"id":"s0011","text":"Acepto recibir correos de Folkly."},{"id":"s0012","text":"Usamos tu correo para las novedades de Folkly. Tu dirección se guarda de forma privada. Los correos incluyen un enlace para cancelar la suscripción cuando el envío esté activado."},{"id":"s0013","text":"Política de privacidad"},{"id":"s0014","text":"."},{"id":"s0015","text":"Suscribirse"},{"id":"s0016","text":"Volver a la revista"},{"id":"s0017","text":"Política de privacidad"},{"id":"s0018","text":"·"},{"id":"s0019","text":"Ajustes de privacidad"},{"id":"s0020","text":"Tus decisiones sobre privacidad"},{"id":"s0021","text":"El almacenamiento esencial permite el inicio de sesión y recuerda estas decisiones. La analítica opcional nos ayuda a entender cómo se usa la revista. Los anuncios están desactivados por ahora."},{"id":"s0022","text":"Lee nuestra política de privacidad"},{"id":"s0023","text":"Permitir Google Analytics"},{"id":"s0024","text":"La publicidad permanece desactivada hasta que se configure un proveedor de consentimiento certificado."},{"id":"s0025","text":"Aceptar analítica"},{"id":"s0026","text":"Rechazar cookies opcionales"},{"id":"s0027","text":"Gestionar preferencias"},{"id":"s0028","text":"Guardar preferencias"}]}