{"format":"folkly-translation-v1","slug":"ui-about","locale":"es","sourceHash":"c63d2b69171e6382a4ae6b64d6217a2fc6d59ccdb6c9fb6d16522d1cc2885442","glossaryHash":"cc47218883939911ed62c5ed9601d828e2f83ff73ba3ce5b90d6bd7c910f796a","promptVersion":"faithful-public-segments-v1","fallbackLabel":"Esta página también está disponible en inglés.","segments":[{"id":"s0001","text":"Sobre Folkly — Cultura y Lugar"},{"id":"s0002","text":"Conoce Folkly, una revista sobre Cultura y Lugar. Explora nuestra perspectiva editorial, propone una historia o conviértete en colaborador."},{"id":"s0003","text":"Sobre Folkly — Cultura y Lugar"},{"id":"s0004","text":"Conoce Folkly, una revista sobre Cultura y Lugar. Explora nuestra perspectiva editorial, propone una historia o conviértete en colaborador."},{"id":"s0005","text":"Saltar al contenido"},{"id":"s0006","text":"Folkly, inicio"},{"id":"s0007","text":"folkly"},{"id":"s0008","text":"Navegación principal"},{"id":"s0009","text":"Cultura"},{"id":"s0010","text":"Archivo"},{"id":"s0011","text":"Acerca de"},{"id":"s0012","text":"Lugares"},{"id":"s0013","text":"Suscríbete"},{"id":"s0014","text":"Sobre Folkly"},{"id":"s0015","text":"Historias sobre la intersección"},{"id":"s0016","text":"de Cultura y Lugar."},{"id":"s0017","text":"Una procesión, una práctica de tejido, una escena musical: cada una abre una historia sobre personas, historia y pertenencia. Folkly explora qué hace distintivo a un lugar y qué permite que su vida cultural crezca, cambie y perdure."},{"id":"s0018","text":"La revista nace del proyecto Creative Cities de Noah Rappaport. Su trabajo en dirección creativa y pensamiento de sistemas alimenta una curiosidad por las relaciones bajo la expresión cotidiana: quién la hace, qué la sostiene y qué hace posible para otros."},{"id":"s0019","text":"La identidad es algo que seguimos construyendo."},{"id":"s0020","text":"El marco de Noah,"},{"id":"s0021","text":"Identidad adaptativa a través de la lucha"},{"id":"s0022","text":", pregunta cómo responden las comunidades al cambio y hacen suya una identidad heredada. Una tecnología nueva, una presión económica o un encuentro con otra cultura pueden trastornar formas familiares de vivir. La gente negocia qué preservar, qué tomar prestado y qué crear."},{"id":"s0023","text":"El ciclo de identidad adaptativa"},{"id":"s0024","text":"Cinco momentos conectados ofrecen una vía hacia estas preguntas. Son incentivos para la indagación, no una secuencia que toda comunidad deba seguir."},{"id":"s0025","text":"01"},{"id":"s0026","text":"Encuentro y disrupción"},{"id":"s0027","text":"Un entorno cambiante pone en contacto las formas familiares de vivir con condiciones nuevas."},{"id":"s0028","text":"02"},{"id":"s0029","text":"Negociación de identidad"},{"id":"s0030","text":"La gente reconsidera qué pertenece, adaptando influencias externas o protegiendo una distinción significativa."},{"id":"s0031","text":"03"},{"id":"s0032","text":"Respuesta creativa"},{"id":"s0033","text":"La música, la comida, el oficio, el ritual, el diseño y la invención práctica dan forma a una respuesta."},{"id":"s0034","text":"04"},{"id":"s0035","text":"Integración"},{"id":"s0036","text":"Repetida, enseñada y apoyada, una práctica nueva pasa a formar parte de la vida ordinaria."},{"id":"s0037","text":"05"},{"id":"s0038","text":"Identidad renovada"},{"id":"s0039","text":"Una comprensión transformada se convierte en un legado que otra generación puede llevar adelante."},{"id":"s0040","text":"La lucha es central en esta teoría de trabajo, pero la adversidad no garantiza el crecimiento. Su severidad, el apoyo disponible y la posibilidad de pérdida importan. La actividad creativa puede satisfacer necesidades prácticas, profundizar la pertenencia y abrir nuevas preguntas a la vez; son propósitos superpuestos, no una jerarquía de culturas."},{"id":"s0041","text":"Cómo abordamos una historia"},{"id":"s0042","text":"Partimos de un lugar y una práctica concretos. Preguntamos qué personas, relaciones, recursos e historias los hacen posibles. Nuestros ensayos enlazan sus fuentes y distinguen la historia documentada de la interpretación. Los términos locales reciben contexto, y las diferencias dentro de las comunidades siguen siendo parte de la historia."},{"id":"s0043","text":"Las personas y la evidencia pueden desafiar el marco. La pregunta queda abierta: ¿qué lleva adelante una comunidad y qué hace posible después?"},{"id":"s0044","text":"Ayuda a contar la próxima historia"},{"id":"s0045","text":"Folkly busca colaboradores con conocimiento de la cultura local, el oficio, la música y las personas que dan forma a un lugar. Comparte una idea de historia, sugiere una corrección o cuéntanos cómo te gustaría contribuir."},{"id":"s0046","text":"Tu nombre"},{"id":"s0047","text":"Correo electrónico"},{"id":"s0048","text":"¿Por qué te pones en contacto con Folkly?"},{"id":"s0049","text":"Elige un motivo"},{"id":"s0050","text":"Proponer una historia"},{"id":"s0051","text":"Solicitar una corrección"},{"id":"s0052","text":"Ser colaborador"},{"id":"s0053","text":"Hablar de una colaboración"},{"id":"s0054","text":"Otra cosa"},{"id":"s0055","text":"Me interesa ser colaborador."},{"id":"s0056","text":"Tu mensaje"},{"id":"s0057","text":"10–3.000 caracteres. Por favor, no incluyas información personal sensible."},{"id":"s0058","text":"Deja este campo vacío"},{"id":"s0059","text":"Acepto que Folkly guarde mis datos de contacto y mi mensaje de forma privada para responder a esta consulta. Esto no me suscribe al boletín."},{"id":"s0060","text":"Enviar mensaje"},{"id":"s0061","text":"folkly"},{"id":"s0062","text":"Historias sobre la intersección de Cultura y Lugar."},{"id":"s0063","text":"Navegación del pie"},{"id":"s0064","text":"Cultura"},{"id":"s0065","text":"Archivo"},{"id":"s0066","text":"Sobre Folkly"},{"id":"s0067","text":"Un proyecto de Then Media inc."},{"id":"s0068","text":"Palabras, lugares y las personas que les dan significado."},{"id":"s0069","text":"Política de privacidad"},{"id":"s0070","text":"·"},{"id":"s0071","text":"Ajustes de privacidad"},{"id":"s0072","text":"Tus decisiones sobre privacidad"},{"id":"s0073","text":"El almacenamiento esencial permite el inicio de sesión y recuerda estas decisiones. La analítica opcional nos ayuda a entender cómo se usa la revista. Los anuncios están desactivados por ahora."},{"id":"s0074","text":"Lee nuestra política de privacidad"},{"id":"s0075","text":"Permitir Google Analytics"},{"id":"s0076","text":"La publicidad permanece desactivada hasta que se configure un proveedor de consentimiento certificado."},{"id":"s0077","text":"Aceptar analítica"},{"id":"s0078","text":"Rechazar cookies opcionales"},{"id":"s0079","text":"Gestionar preferencias"},{"id":"s0080","text":"Guardar preferencias"}]}