{"format":"folkly-translation-v1","slug":"ui-privacy","locale":"ar","sourceHash":"2a4355bda7d17485d4333d07a43cc62b54374ac17303cca7ac98988b2f61177e","glossaryHash":"cc47218883939911ed62c5ed9601d828e2f83ff73ba3ce5b90d6bd7c910f796a","promptVersion":"faithful-public-segments-v1","fallbackLabel":"هذه الصفحة متاحة أيضًا باللغة الإنجليزية.","segments":[{"id":"s0001","text":"سياسة الخصوصية | Folkly"},{"id":"s0002","text":"كيف يتعامل Folkly مع الاشتراكات ورسائل التواصل وملفات تعريف الارتباط وخيارات الخصوصية."},{"id":"s0003","text":"folkly"},{"id":"s0004","text":"سياسة الخصوصية"},{"id":"s0005","text":"نافذة اعتبارًا من 8 أكتوبر 2026. Folkly مشروع تابع لـ Then Media inc. للتواصل:"},{"id":"s0006","text":"noah@then.tv"},{"id":"s0007","text":"لأي أسئلة أو طلبات تخص الخصوصية."},{"id":"s0008","text":"المعلومات التي تقدمها"},{"id":"s0009","text":"تجمع الاشتراكات عنوان بريدك الإلكتروني وسجل الموافقة وحالة الاشتراك لأجل تحديثات القصص الأسبوعية. تجمع نماذج التواصل اسمك وبريدك وسبب التواصل ورسالتك واهتمامك بالمساهمة كي نتمكن من الرد. لا ترسل معلومات شخصية حساسة عبر هذه النماذج. لا يترتب على مراسلتنا اشتراكك في النشرة."},{"id":"s0010","text":"كيف تُخزَّن المعلومات وتُستخدم"},{"id":"s0011","text":"تُحفظ سجلات المشتركين والتواصل في تخزين Vercel Blob الخاص. تستضيف Vercel الموقع وتعالج معلومات الطلبات التشغيلية لتوصيله وتأمينه. توفر Supabase مصادقة المالك والتخزين التحريري الخاص. وResend هو مزوّد إرسال النشرة المُهيَّأ؛ يعتمد الإرسال على التفعيل وإعدادات مُرسِل موثقة. تعالج هذه المزودات المعلومات لخدماتها المعنية. تُقدَّم بعض الصور المنسوبة عبر خوادم صور Wikimedia التي تستقبل الطلبات اللازمة لعرضها. تؤدي روابط المصادر والموسيقى الخارجية إلى مواقع لها ممارسات خصوصيتها الخاصة. لا نقدم سجلات المشتركين أو التواصل إلى Google Analytics أو وسوم الإعلانات."},{"id":"s0012","text":"ملفات تعريف الارتباط والتحليلات والإعلانات"},{"id":"s0013","text":"ملفات تسجيل الدخول الأساسية تدعم منطقة المالك الخاصة. تحفظ ميزة محلية في المتصفح قرارك بشأن ملفات الارتباط الاختيارية لمدة تصل إلى 180 يومًا. لا يُحمَّل Google Analytics (GA4) إلا إذا سمحت بالتحليلات؛ فهو يقيس الزيارات والتفاعلات وقد يستخدم معرفات وملفات ارتباط. تُستثنى سلاسل الاستعلام ومقاطع URL من إعداد المشاهدات الأولي لدينا. لا تُحمَّل التحليلات في لوحة المالك. عطَّلنا إشارات Google وإشارات تخصيص الإعلانات في إعدادات تحليلات الموقع."},{"id":"s0014","text":"نصوص الإعلانات محجوبة حاليًا بانتظار إعداد مزوّد موافقة معتمد. إذا فُعِّلت إعلانات Google، فيمكن لـ Google وشركاء الإعلان المعلنين استخدام ملفات الارتباط لعرض إعلانات استنادًا إلى زياراتك السابقة لهذا الموقع وغيره، وفق خياراتك المعمول بها. يجب تحديث هذه السياسة وواجهة الموافقة قبل التفعيل. انظر"},{"id":"s0015","text":"كيف يستخدم Google معلومات مواقع الشركاء"},{"id":"s0016","text":"و"},{"id":"s0017","text":"خيارات الإعلانات لدى Google"},{"id":"s0018","text":"."},{"id":"s0019","text":"خياراتك"},{"id":"s0020","text":"استخدم «إعدادات الخصوصية» في أي صفحة عامة لرفض ملفات الارتباط الاختيارية أو تغيير موافقة التحليلات. يبقى الإصدار متاحًا عند الرفض. يؤدي سحب الموافقة إلى إعادة تحميل الصفحة لإيقاف وسم التحليلات ومحاولة مسح ملفات ارتباط التحليلات المتاحة؛ ولا يمكنه محو ما عالجه Google سابقًا. يُبقي هذا الموقع الإعلانات معطلة، حتى عند وجود إشارة Global Privacy Control. تتضمن رسائل النشرة رابط إلغاء الاشتراك عند تفعيل الإرسال. يمكنك طلب الوصول إلى معلوماتك أو تصحيحها أو حذفها بمراسلة العنوان أعلاه؛ وقد نتحقق من الطلب قبل تسليم السجلات."},{"id":"s0021","text":"الاحتفاظ والحماية"},{"id":"s0022","text":"تبقى سجلات الاشتراك ما دام الاشتراك نشطًا. قد تُحفظ معلومات إيقاف دنيا لاحترام طلبات إلغاء الاشتراك. تُحفظ سجلات التواصل والتحرير ما دامت ضرورية لغرضها، رهن طلبات الحذف والاحتياجات الأمنية أو القانونية المشروعة. لا يوجد حاليًا جدول حذف تلقائي. نقيّد الوصول إلى السجلات الخاصة، لكن لا يضمن أمان أي نظام عبر الإنترنت. قد يعالج المزودون المعلومات خارج بلدك."},{"id":"s0023","text":"محادثة تحرير المالك"},{"id":"s0024","text":"تحفظ مساحة عمل المالك الخاصة أفكار المقالات ومحادثات التحرير في تخزين Vercel Blob الخاص. عند تمكين محادثة التحرير واستخدامها، تُرسل رسالة المالك وسجل حديث محدود من المحادثات إلى OpenAI لإنشاء رد. لا تُدرج تلقائيًا إرسالات نماذج القراءة العامة في هذه المحادثات."},{"id":"s0025","text":"الأطفال والتغييرات"},{"id":"s0026","text":"المجلة موجهة لجمهور عام ولا نجمع عمدًا معلومات شخصية من الأطفال دون 13 عامًا. تواصل معنا إذا قدَّم طفل معلومات. سنحدّث هذه الصفحة عند تغيّر ممارساتنا، وسنطلب خيارات جديدة لملفات الارتباط الاختيارية عند تغيّر سياسة الموافقة."},{"id":"s0027","text":"سياسة الخصوصية"},{"id":"s0028","text":"·"},{"id":"s0029","text":"إعدادات الخصوصية"},{"id":"s0030","text":"خياراتك في الخصوصية"},{"id":"s0031","text":"التخزين الأساسي يدعم تسجيل الدخول ويحفظ هذه الخيارات. وتساعدنا التحليلات الاختيارية في فهم كيفية استخدام المجلة. الإعلانات متوقفة حاليًا."},{"id":"s0032","text":"اقرأ سياسة الخصوصية لدينا"},{"id":"s0033","text":"السماح بـ Google Analytics"},{"id":"s0034","text":"تبقى الإعلانات متوقفة حتى يتم إعداد مزوّد موافقة معتمد."},{"id":"s0035","text":"قبول التحليلات"},{"id":"s0036","text":"رفض ملفات تعريف الارتباط الاختيارية"},{"id":"s0037","text":"إدارة التفضيلات"},{"id":"s0038","text":"حفظ التفضيلات"}]}