{"format":"folkly-translation-v1","slug":"ui-subscribe","locale":"ja","sourceHash":"733af746dd178eeed2374039dd8abfa12e01ae806d869de50ab7721115d03e97","glossaryHash":"cc47218883939911ed62c5ed9601d828e2f83ff73ba3ce5b90d6bd7c910f796a","promptVersion":"faithful-public-segments-v1","fallbackLabel":"このページは英語でもご覧いただけます。","segments":[{"id":"s0001","text":"購読 | Folkly"},{"id":"s0002","text":"文化と場所が交わる点をめぐる新しいストーリーを、毎週のメールでお届けします。"},{"id":"s0003","text":"Folkly ホーム"},{"id":"s0004","text":"folkly"},{"id":"s0005","text":"Folkly ジャーナル"},{"id":"s0006","text":"文化を、お届け。"},{"id":"s0007","text":"文化と場所が交わる点をめぐる新しいストーリーを、毎週のメールでお届けします。"},{"id":"s0008","text":"メールアドレス"},{"id":"s0009","text":"あなた@example.com"},{"id":"s0010","text":"この欄は空欄のままにしてください"},{"id":"s0011","text":"Folkly からのメールを受け取ることに同意します。"},{"id":"s0012","text":"メールアドレスは Folkly の更新情報にのみ使用します。アドレスは非公開で保存されます。配信が有効になっている場合、メールには配信停止へのリンクが含まれます。"},{"id":"s0013","text":"プライバシーポリシー"},{"id":"s0014","text":"。"},{"id":"s0015","text":"登録する"},{"id":"s0016","text":"ジャーナルに戻る"},{"id":"s0017","text":"プライバシーポリシー"},{"id":"s0018","text":"・"},{"id":"s0019","text":"プライバシー設定"},{"id":"s0020","text":"あなたのプライバシーに関する選択"},{"id":"s0021","text":"必須のストレージはサインインを支え、これらの選択を記憶します。オプションのアナリティクスは、このジャーナルがどのように使われているかを理解するのに役立ちます。広告は現在オフになっています。"},{"id":"s0022","text":"プライバシーポリシーを読む"},{"id":"s0023","text":"Google Analytics を許可する"},{"id":"s0024","text":"認定済みの同意プロバイダーが設定されるまで、広告はオフのままになります。"},{"id":"s0025","text":"アナリティクスを許可"},{"id":"s0026","text":"オプションの cookie を拒否"},{"id":"s0027","text":"設定を管理"},{"id":"s0028","text":"設定を保存"}]}