{"format":"folkly-translation-v1","slug":"ui-privacy","locale":"fr","sourceHash":"2a4355bda7d17485d4333d07a43cc62b54374ac17303cca7ac98988b2f61177e","glossaryHash":"cc47218883939911ed62c5ed9601d828e2f83ff73ba3ce5b90d6bd7c910f796a","promptVersion":"faithful-public-segments-v1","fallbackLabel":"Cette page est également disponible en anglais.","segments":[{"id":"s0001","text":"Politique de confidentialité | Folkly"},{"id":"s0002","text":"Comment Folkly traite les abonnements, les messages de contact, les cookies et vos choix de confidentialité."},{"id":"s0003","text":"folkly"},{"id":"s0004","text":"Politique de confidentialité"},{"id":"s0005","text":"En vigueur depuis le 8 octobre 2026. Folkly est un projet de Then Media inc. Contact :"},{"id":"s0006","text":"noah@then.tv"},{"id":"s0007","text":"pour toute question ou demande relative à la confidentialité."},{"id":"s0008","text":"Les informations que vous fournissez"},{"id":"s0009","text":"Les abonnements collectent votre adresse e-mail, l'enregistrement de votre consentement et le statut de l'abonnement pour les envois hebdomadaires d'histoires. Les formulaires de contact collectent votre nom, votre e-mail, le motif du contact, votre message et votre intérêt pour une contribution, afin de pouvoir répondre. N'envoyez pas d'informations personnelles sensibles dans ces formulaires. Nous écrire ne vous abonne pas à la lettre."},{"id":"s0010","text":"Conservation et usage des informations"},{"id":"s0011","text":"Les enregistrements d'abonnés et de contacts sont conservés dans le stockage privé Vercel Blob. Vercel héberge le site et traite les informations opérationnelles des requêtes pour le livrer et le sécuriser. Supabase assure l'authentification du propriétaire et le stockage éditorial privé. Resend est le fournisseur configuré pour l'envoi de la lettre ; l'envoi dépend de son activation et de réglages d'expéditeur vérifiés. Ces fournisseurs traitent les informations pour les services concernés. Certaines images créditées sont diffusées via les serveurs d'images de Wikimedia, qui reçoivent les requêtes nécessaires à leur affichage. Les liens externes vers sources et musiques mènent vers des sites ayant leurs propres pratiques de confidentialité. Nous ne fournissons aucun enregistrement d'abonné ou de contact à Google Analytics ni aux balises publicitaires."},{"id":"s0012","text":"Cookies, analyses et publicité"},{"id":"s0013","text":"Les cookies essentiels de connexion prennent en charge l'espace privé du propriétaire. Une préférence locale du navigateur conserve votre décision sur les cookies facultatifs jusqu'à 180 jours. Google Analytics (GA4) ne se charge que si vous autorisez les analyses ; il mesure les visites et les interactions et peut utiliser des identifiants et des cookies. Les chaînes de requête et les fragments d'URL sont exclus de notre configuration initiale des pages vues. Les analyses ne sont pas chargées dans l'espace propriétaire. Nous désactivons Google Signals et les signaux de personnalisation publicitaire dans la configuration d'analyse du site."},{"id":"s0014","text":"Les scripts publicitaires sont actuellement bloqués dans l'attente de la mise en place d'un fournisseur de consentement certifié. Si la publicité Google est activée, Google et d'autres partenaires publicitaires divulgués peuvent utiliser des cookies pour diffuser des annonces fondées sur vos visites antérieures de ce site et d'autres, selon vos choix applicables. Cette politique et l'interface de consentement devront être mises à jour avant toute activation. Voir"},{"id":"s0015","text":"comment Google utilise les informations des sites partenaires"},{"id":"s0016","text":"et"},{"id":"s0017","text":"les choix publicitaires de Google"},{"id":"s0018","text":"."},{"id":"s0019","text":"Vos choix"},{"id":"s0020","text":"Utilisez les Paramètres de confidentialité sur n'importe quelle page publique pour refuser les cookies facultatifs ou modifier votre consentement aux analyses. Le refus laisse la revue disponible. Le retrait recharge la page pour arrêter la balise d'analyse du site et tente d'effacer les cookies d'analyse accessibles ; il ne peut pas effacer les données déjà traitées par Google. Ce site maintient la publicité désactivée, y compris en présence d'un signal Global Privacy Control. Les e-mails de la lettre incluent un lien de désabonnement lorsque l'envoi est activé. Vous pouvez demander l'accès, la rectification ou la suppression des informations fournies en écrivant à l'adresse ci-dessus ; nous pouvons vérifier la demande avant de communiquer des enregistrements."},{"id":"s0021","text":"Conservation et protection"},{"id":"s0022","text":"Les enregistrements d'abonnement sont conservés tant que l'abonnement est actif. Des informations minimales de suppression peuvent être conservées pour honorer les demandes de désabonnement. Les enregistrements de contact et éditoriaux sont conservés autant que nécessaire à leur finalité, sous réserve des demandes de suppression et des besoins légitimes de sécurité ou juridiques. Aucun calendrier de suppression automatique n'est actuellement en place. Nous restreignons l'accès aux enregistrements privés, mais aucun système en ligne n'est garanti sûr. Les fournisseurs peuvent traiter des informations hors de votre pays."},{"id":"s0023","text":"Chat de rédaction du propriétaire"},{"id":"s0024","text":"L'espace de travail privé du propriétaire conserve les idées d'articles et les conversations de rédaction dans le stockage privé Vercel Blob. Lorsque le chat de rédaction est activé et utilisé, le message du propriétaire et un historique récent limité sont envoyés à OpenAI pour générer une réponse. Les soumissions de formulaires publics ne sont pas automatiquement incluses dans ces conversations."},{"id":"s0025","text":"Enfants et modifications"},{"id":"s0026","text":"La revue s'adresse à un public général et nous ne collectons pas sciemment d'informations personnelles d'enfants de moins de 13 ans. Contactez-nous si un enfant nous a transmis des informations. Nous mettrons à jour cette page si nos pratiques changent et demanderons de nouveaux choix de cookies facultatifs si la politique de consentement évolue."},{"id":"s0027","text":"Politique de confidentialité"},{"id":"s0028","text":"·"},{"id":"s0029","text":"Paramètres de confidentialité"},{"id":"s0030","text":"Vos choix de confidentialité"},{"id":"s0031","text":"Le stockage essentiel permet la connexion et mémorise ces choix. Les analyses optionnelles nous aident à comprendre comment la revue est utilisée. La publicité est actuellement désactivée."},{"id":"s0032","text":"Lire notre politique de confidentialité"},{"id":"s0033","text":"Autoriser Google Analytics"},{"id":"s0034","text":"La publicité restera désactivée jusqu'à la configuration d'un fournisseur de consentement certifié."},{"id":"s0035","text":"Accepter les analyses"},{"id":"s0036","text":"Refuser les cookies facultatifs"},{"id":"s0037","text":"Gérer les préférences"},{"id":"s0038","text":"Enregistrer les préférences"}]}