{"format":"folkly-translation-v1","slug":"nowruz-tajikistan","locale":"ja","sourceHash":"cd45ef404312c8198c4adf2230fc186d8ba05f07265b37bb16ac6e62e8042355","glossaryHash":"cc47218883939911ed62c5ed9601d828e2f83ff73ba3ce5b90d6bd7c910f796a","promptVersion":"faithful-public-segments-v1","fallbackLabel":"このページは英語でも利用できます。","segments":[{"id":"s0001","text":"タジキスタンのナヴルーズ:ドゥシャンベのスマナクと春 | Folkly"},{"id":"s0002","text":"タジキスタンのドゥシャンベでは、ナヴルーズに備えてスマナクをつくることが、隣人たちを共有の鍋と春の訪れのもとに集めます。"},{"id":"s0003","text":"かき混ぜられる鍋:ドゥシャンベでスマナクがつなぐ帰属"},{"id":"s0004","text":"タジキスタンのドゥシャンベでは、ナヴルーズに備えてスマナクをつくることが、隣人たちを共有の鍋と春の訪れのもとに集めます。"},{"id":"s0005","text":"タジキスタンでスマナクの大鍋を囲む人々"},{"id":"s0006","text":"コンテンツへスキップ"},{"id":"s0007","text":"Folkly ホーム"},{"id":"s0008","text":"folkly"},{"id":"s0009","text":"メインナビゲーション"},{"id":"s0010","text":"カルチャー"},{"id":"s0011","text":"アーカイブ"},{"id":"s0012","text":"概要"},{"id":"s0013","text":"場所"},{"id":"s0014","text":"購読する"},{"id":"s0015","text":"ドゥシャンベ、タジキスタン"},{"id":"s0016","text":"かき混ぜられる鍋:ドゥシャンベでスマナクがつなぐ帰属"},{"id":"s0017","text":"タジキスタンのドゥシャンベでは、ナヴルーズに備えてスマナクをつくることが、隣人たちを共有の鍋と春の訪れのもとに集めます。"},{"id":"s0018","text":"タジキスタンでスマナクの大鍋を囲む人々"},{"id":"s0019","text":"タジキスタンのスマナク作り、2018年。"},{"id":"s0020","text":"画像利用の詳細"},{"id":"s0021","text":"この記事の内容"},{"id":"s0022","text":"出典とさらなる読み物"},{"id":"s0023","text":"すべての記事"},{"id":"s0024","text":"炒った小麦とバターの香りは、記憶のひとつの具体的なかたちです。中央アジアのタジキスタンの首都ドゥシャンベでは、この香りは春の新年——現地でナヴルーズ、別名ノウルーズとして知られる——の訪れを告げますが、多くの家庭では、さらに正確な何かを告げています。すなわち、家族が大きな釜を囲んで集まる、その瞬間を。この集まりの中心にある料理がスマナク、発芽した小麦と小麦粉と油からつくられる、濃厚で甘いペーストです。それは単なる食べ物ではありません。忍耐と協調と共同の労働を必要とする、共同の行為です。首都が公的な祝祭の準備を進めるなかで、スマナクをつくる私的な儀礼は、伝統がどのように教えられ、守られ、世代を越えて適応されていくかをはっきりと映す窓となります。"},{"id":"s0025","text":"共有のリズム"},{"id":"s0026","text":"スマナクづくりの共同性は際立っています。一人きりの台所仕事であることはまずありません。タジキスタンの多くの家庭では、仕事は役割と体力によって分かたれます。絶え間ない攪拌の先頭に立つのはしばしば女性で、焦げやダマを防ぐため絶えず気を配り続ける仕事です。この労働には歌と身ぶりが伴い、調理の過程はひとつの上演になります。男性はしばしば火の管理や重い釜の運搬、原材料の支度でこれを支えます。この分業が、異なる役割がひとつの目標に向かって収束する、共有された空間をつくり出します。"},{"id":"s0027","text":"ナヴルーズに備えたスマラク、タジキスタン"},{"id":"s0028","text":"ナヴルーズに備えたスマラク、タジキスタン。"},{"id":"s0029","text":"2025年のユネスコによる「スマナク/スマラク調理の文化」の登録は、この共同性を実践の鍵となる要素として際立たせました。ユネスコはスマナクを準備する共有の仕事を、その季節的な意味と並べて置いています。鍋を囲む集まりは、隣人や親族が絆を新たにする時間を与えます。共有された努力をとおして帰属を触知可能にする実践なのです。鍋そのものが焦点となり、関係が交渉され新たにされる、物理的な対象になります。"},{"id":"s0030","text":"長い待ち時間"},{"id":"s0031","text":"沸騰が始まる前には、静かな予感の期間があります。小麦は2、3週間にわたって浸され、芽を出し、世話されなければなりません。この段階はしばしば、過程のなかでもっとも個人的で親密な部分です。多くの家族では、芽を出した小麦の世話は特定の一人に任され、毎日水をやり、暗闇のなかで育つことを確かめます。この世話役は農業の話にとどまりません。忍耐の儀礼です。"},{"id":"s0032","text":"ドゥシャンベのナヴルーズ祝祭、2021年"},{"id":"s0033","text":"ドゥシャンベのナヴルーズ祝祭、2021年。"},{"id":"s0034","text":"ドゥシャンベ在住のシャーホ・ルジマートワは、この実践にまつわる子どもの頃の思い出を語ります。祖母と母がスマナクを準備していたこと、自分が見よう見まねで手伝いながら参加していたことを覚えています。彼女にとって、もっとも大切にされているのは調理そのものではなく、集まることでした。親族や隣人が集まり、子どもたちは遊び、女性たちは火の番をしながら歌いました。このともに過ごした記憶こそが、彼女を自分の家族のなかで伝統を続ける原動力にしています。小麦の世話という行為は、その静かな調理前の段階においても、過去と現在を架橋し、料理する者を以前の世代たちと結びつけます。"},{"id":"s0035","text":"伝統の職業化"},{"id":"s0036","text":"スマナクが家庭生活に深く根ざしている一方で、職人の世界にも入っています。タジキスタンのフソニヨン地区では、63歳のマヴルダ・ソティヴォルディエバが6年間、スマナクを職業として準備しています。彼女は300リットルの釜を使い、家族のためと販売分の両方をつくり出します。彼女の歩みは、伝統的な知識がどう規模を拡大され、持続されうるかを示しています。多くの実践者と同じく母から技を学び、今度は自分の孫娘たちや嫁たちに教えてきました。"},{"id":"s0037","text":"ナヴルーズのドゥシャンベ・ドスティ広場、2022年"},{"id":"s0038","text":"ナヴルーズのドゥシャンベ・ドスティ広場、2022年。"},{"id":"s0039","text":"マヴルダの仕事は、この過程の身体的な要求を浮き彫りにします。準備にはおよそ丸一日の連続した努力がかかり、その時間の覚悟が多くの人を挑戦から遠ざけてきました。彼女はこの技を、献身と体力を要する芸術だと表現します。スマナクを売ることで、彼女は伝統を守るだけでなく、それをめぐる経済的な生計も切り拓いています。息子と嫁が完成品をボフタル市の市場まで運ぶのを手伝い、そこではタジキスタンの通貨ソモニで1リットル20ソモニで売られます。この商業的な側面は文化的価値を減じません。むしろ実践の多面性を示しています。私的な家族の儀礼にも、公的な共同体の行事にも、職業的なサービスにもなりうるのです。"},{"id":"s0040","text":"教えること、伝えること"},{"id":"s0041","text":"人々はいくつかの場でスマナクのつくり方を学びます。家族のなかでの実践がひとつの道であり、学校や文化の集まりが他を提供します。この世代間の移譲が、技の機微が失われないことを保証します。攪拌の正確なタイミングや発芽小麦への手入れといった一つひとつの技法は、観察と参加をとおして学ばれます。"},{"id":"s0042","text":"ドゥシャンベのナヴルーズ、2024年"},{"id":"s0043","text":"ドゥシャンベのナヴルーズ、2024年。"},{"id":"s0044","text":"ドゥシャンベでは、この伝承は公的な取り組みに支えられています。春の祝祭を首都に届ける公共行事「ナヴルーズのキャラバン」は、こうした伝統を披露する場となっています。普段は私的な家のなかに限定されている実践を目にする機会を、住民にも訪問者にも与えます。スマナクの準備を公衆の眼前に持ち出すことで、これらの行事はこの料理の文化的な意義を確かなものにし、より広い参加を促します。知識は学校や文化行事をとおしても共有され、定期的に準備される家庭に住まない若い世代であっても、この実践に触れることが保証されます。"},{"id":"s0045","text":"続いていく可能性"},{"id":"s0046","text":"スマナクづくりの実践は、核心となる同一性を保ちながら進化を続けています。古く、かつ適応力のある伝統です。発芽小麦を砕くのにミンサーのような現代の道具を使うことは過程の一部を効率化しましたが、共同の労働、忍耐、分かち合われた楽しみという本質的な要素は変わらないままです。この料理は、団結、繁栄、更新の象徴として働きつづけ、年齢や社会の境界を越えて人々を結びつけています。"},{"id":"s0047","text":"キルギス、チュイ州アク・エルゲーでのスマラク調理"},{"id":"s0048","text":"キルギス、チュイ州アク・エルゲーでのスマラク調理。"},{"id":"s0049","text":"ドゥシャンベがナヴルーズの準備を進めるいま、スマナクの鍋は祝祭の中心的な象徴でありつづけます。歴史の重みと未来の約束を納めた、触れられるものです。攪拌し、歌い、食べるという共有の行為をとおして、伝統は帰属を触知可能にします。季節の移り変わりを印すだけの実践ではありません。共同体を支える社会的な織り目を強化するのです。急速に変わる世界のなかで、スマナクの鍋は確かな錨であり、いくつかの結びつきのかたちは忍耐と思いやり、そして食を分かち合うという単純な行為によって築かれるのだということを思い出させます。"},{"id":"s0050","text":"共有の鍋をめぐる仕事"},{"id":"s0051","text":"共同の準備は食材以上のものを集めます。人々は時間を調整し、仕事を分け、互いに場所を譲り、次に何が起きるべきかを見定めます。完成した料理が祝祭の主役のイメージになると、この組織化は見落とされやすくなります。鍋をめぐる仕事に目を向けることで、社会的な次元はより具体的になります。帰属は、人々がともに行うことのなかにあらわれ、その場が何を表すかと言われることだけにあるのではありません。"},{"id":"s0052","text":"ドゥシャンベのチューリップ"},{"id":"s0053","text":"ドゥシャンベのチューリップ。"},{"id":"s0054","text":"タジキスタンにおけるスマナクの記述は、その固有の文脈のなかに属するものです。ナヴルーズはさまざまな国と共同体で祝われ、国際的な記述がすべての準備を同一のものにするわけではありません。"},{"id":"s0055","text":"他国からの画像が関わりのある料理を示しうるのは、その場所が明かされている場合のみです。閲覧者が共有された祝祭に見当をつけうるからといって、ドゥシャンベの光景として説明されてはなりません。"},{"id":"s0056","text":"外からこの実践に出会う読者にとって、もっとも有用な問いは参加に関わるものです。準備の知識は誰が担っているのか。新しい人はどのようにして仕事に迎え入れられるのか。祝祭のどの部分が、年長者と若い世代がともに時間を過ごすことを可能にするのか。こうした問いは、季節の更新を、関係によって支えられた活動として理解しやすくします。また、調査に基づいた文化エッセイを説明書に変えてしまうことや、記述されたひとつの集まりがすべての人を代表すると主張することも避けます。"},{"id":"s0057","text":"ドスティ広場、ドゥシャンベ、ナヴルーズ期間中、2022年3月"},{"id":"s0058","text":"ドスティ広場、ドゥシャンベ、ナヴルーズ期間中、2022年3月。"},{"id":"s0059","text":"関連記事"},{"id":"s0060","text":"ソウルのキムジャンで、ピンクの手袋をした隣人たちが一緒にキャベツに薬味をまぶす"},{"id":"s0061","text":"記憶する手:変わりゆくソウルのキムジャン"},{"id":"s0062","text":"共同の仕事をとおして冬のキムチをつくる。"},{"id":"s0063","text":"暗い星野に浮かぶプレアデス星団、マタリキとして知られる"},{"id":"s0064","text":"年の始まりを告げる星"},{"id":"s0065","text":"マオリの新年の伝統における追悼と更新。"},{"id":"s0066","text":"タラゴナのカステル大会で、人の塔が群衆の上に立ち上がる"},{"id":"s0067","text":"広場の重み:タラゴナの人間の塔"},{"id":"s0068","text":"カタルーニャのタラゴナでは、カステルは人間の塔を、広場における信頼と訓練と帰属の共有された営みへと変えています。"},{"id":"s0069","text":"ボンワイレで木の織機に黄色いケンテの糸を通す織り手"},{"id":"s0070","text":"つなぎ止める糸:ボンワイレのケンテ、アイデンティティと生き残りの闘い"},{"id":"s0071","text":"ガーナのボンワイレでは、ケンテ織りが、変わる市場と家族の工房とその将来をめぐる議論のなかを、ことわざとアイデンティティとともに運んでいきます。"},{"id":"s0072","text":"folkly"},{"id":"s0073","text":"文化と場所の交差点をめぐる物語。"},{"id":"s0074","text":"フッターナビゲーション"},{"id":"s0075","text":"カルチャー"},{"id":"s0076","text":"アーカイブ"},{"id":"s0077","text":"Folkly について"},{"id":"s0078","text":"Then Media inc. のプロジェクト。"},{"id":"s0079","text":"言葉、場所、そしてそれに意味を与える人々。"},{"id":"s0080","text":"プライバシーポリシー"},{"id":"s0081","text":"·"},{"id":"s0082","text":"プライバシー設定"},{"id":"s0083","text":"あなたのプライバシーの選択"},{"id":"s0084","text":"必須ストレージはサインインを支え、この選択を記憶します。任意の分析は雑誌の使われ方を知る助けになります。広告は現在無効です。"},{"id":"s0085","text":"プライバシーポリシーを読む"},{"id":"s0086","text":"Google Analytics を許可"},{"id":"s0087","text":"認証済みの同意プロバイダーが設定されるまで広告は無効のままです。"},{"id":"s0088","text":"分析を許可"},{"id":"s0089","text":"任意のクッキーを拒否"},{"id":"s0090","text":"設定を管理"},{"id":"s0091","text":"設定を保存"}]}