{"format":"folkly-translation-v1","slug":"ui-privacy","locale":"es","sourceHash":"2a4355bda7d17485d4333d07a43cc62b54374ac17303cca7ac98988b2f61177e","glossaryHash":"cc47218883939911ed62c5ed9601d828e2f83ff73ba3ce5b90d6bd7c910f796a","promptVersion":"faithful-public-segments-v1","fallbackLabel":"Esta página también está disponible en inglés.","segments":[{"id":"s0001","text":"Política de privacidad | Folkly"},{"id":"s0002","text":"Cómo Folkly gestiona las suscripciones, los mensajes de contacto, las cookies y tus decisiones de privacidad."},{"id":"s0003","text":"folkly"},{"id":"s0004","text":"Política de privacidad"},{"id":"s0005","text":"En vigor desde el 8 de octubre de 2026. Folkly es un proyecto de Then Media inc. Contacto:"},{"id":"s0006","text":"noah@then.tv"},{"id":"s0007","text":"para preguntas o solicitudes de privacidad."},{"id":"s0008","text":"Información que nos proporcionas"},{"id":"s0009","text":"Las suscripciones recogen tu dirección de correo, el registro de consentimiento y el estado de la suscripción para los envíos semanales de historias. Los formularios de contacto recogen tu nombre, correo, motivo del contacto, mensaje e interés en colaborar, para poder responder. No envíes información personal sensible en estos formularios. Escribirnos no te suscribe al boletín."},{"id":"s0010","text":"Cómo se guarda y usa la información"},{"id":"s0011","text":"Los registros de suscriptores y contactos se guardan en almacenamiento privado de Vercel Blob. Vercel aloja el sitio y procesa la información operativa de las peticiones para entregarlo y protegerlo. Supabase ofrece la autenticación del propietario y el almacenamiento editorial privado. Resend es el proveedor configurado para el envío del boletín; el envío depende de su activación y de una configuración verificada del remitente. Estos proveedores tratan la información para los servicios correspondientes. Algunas imágenes con crédito se entregan mediante servidores de imágenes de Wikimedia, que reciben las peticiones necesarias para mostrarlas. Los enlaces externos a fuentes y música llevan a sitios con sus propias prácticas de privacidad. No proporcionamos registros de suscriptores ni de contactos a Google Analytics ni a etiquetas publicitarias."},{"id":"s0012","text":"Cookies, analítica y publicidad"},{"id":"s0013","text":"Las cookies esenciales de sesión admiten el área privada del propietario. Una preferencia local del navegador guarda tu decisión sobre cookies opcionales hasta 180 días. Google Analytics (GA4) se carga solo si permites la analítica; mide visitas e interacciones y puede usar identificadores y cookies. Las cadenas de consulta y los fragmentos de URL quedan excluidos de nuestra configuración inicial de páginas vistas. La analítica no se carga en el panel del propietario. Desactivamos Google Signals y las señales de personalización publicitaria en la configuración de analítica del sitio."},{"id":"s0014","text":"Los scripts publicitarios están bloqueados por ahora, en espera de la configuración de un proveedor de consentimiento certificado. Si se activa la publicidad de Google, Google y otros socios publicitarios declarados podrán usar cookies para mostrar anuncios basados en visitas previas a este y otros sitios, según tus decisiones aplicables. Esta política y la interfaz de consentimiento deben actualizarse antes de la activación. Ver"},{"id":"s0015","text":"cómo Google usa la información de los sitios asociados"},{"id":"s0016","text":"y"},{"id":"s0017","text":"las decisiones publicitarias de Google"},{"id":"s0018","text":"."},{"id":"s0019","text":"Tus decisiones"},{"id":"s0020","text":"Usa Ajustes de privacidad en cualquier página pública para rechazar las cookies opcionales o cambiar tu consentimiento de analítica. Rechazarlas mantiene la revista disponible. Retirar el consentimiento recarga la página para detener la etiqueta de analítica del sitio e intenta limpiar las cookies de analítica accesibles; no puede borrar los datos ya procesados por Google. Este sitio mantiene la publicidad desactivada, incluso cuando hay una señal de Global Privacy Control. Los correos del boletín incluyen un enlace de cancelación cuando el envío está activo. Puedes solicitar acceso, corrección o eliminación de la información que nos proporcionaste escribiendo a la dirección anterior; podemos verificar la solicitud antes de entregar registros."},{"id":"s0021","text":"Conservación y protección"},{"id":"s0022","text":"Los registros de suscripción se conservan mientras la suscripción esté activa. Puede conservarse información mínima de supresión para atender las solicitudes de cancelación. Los registros de contacto y editoriales se mantienen mientras sean necesarios para su fin, sujetos a solicitudes de eliminación y a necesidades legítimas de seguridad o legales. Actualmente no hay un calendario automático de eliminación. Restringimos el acceso a los registros privados, pero ningún sistema en línea está garantizado como seguro. Los proveedores pueden procesar información fuera de tu país."},{"id":"s0023","text":"Chat de edición del propietario"},{"id":"s0024","text":"El espacio de trabajo privado del propietario guarda ideas de artículos y conversaciones de edición en almacenamiento privado de Vercel Blob. Cuando el chat de edición está activo y en uso, el mensaje del propietario y un historial reciente limitado se envían a OpenAI para generar una respuesta. Los envíos de formularios públicos no se incluyen automáticamente en esas conversaciones."},{"id":"s0025","text":"Menores y cambios"},{"id":"s0026","text":"La revista va dirigida a un público general y no recopilamos conscientemente información personal de menores de 13 años. Contáctanos si un menor nos ha proporcionado información. Actualizaremos esta página cuando cambien nuestras prácticas y pediremos nuevas decisiones sobre cookies opcionales cuando cambie la política de consentimiento."},{"id":"s0027","text":"Política de privacidad"},{"id":"s0028","text":"·"},{"id":"s0029","text":"Ajustes de privacidad"},{"id":"s0030","text":"Tus decisiones sobre privacidad"},{"id":"s0031","text":"El almacenamiento esencial permite el inicio de sesión y recuerda estas decisiones. La analítica opcional nos ayuda a entender cómo se usa la revista. Los anuncios están desactivados por ahora."},{"id":"s0032","text":"Lee nuestra política de privacidad"},{"id":"s0033","text":"Permitir Google Analytics"},{"id":"s0034","text":"La publicidad permanece desactivada hasta que se configure un proveedor de consentimiento certificado."},{"id":"s0035","text":"Aceptar analítica"},{"id":"s0036","text":"Rechazar cookies opcionales"},{"id":"s0037","text":"Gestionar preferencias"},{"id":"s0038","text":"Guardar preferencias"}]}