{"format":"folkly-translation-v1","slug":"ui-subscribe","locale":"zh-Hans","sourceHash":"aa3edaf40da4e86ad48a6906a246af04f1cb33641053b1d53b2aef9b15731994","glossaryHash":"cc47218883939911ed62c5ed9601d828e2f83ff73ba3ce5b90d6bd7c910f796a","promptVersion":"faithful-public-segments-v1","fallbackLabel":"此页面也有英文版本。","segments":[{"id":"s0001","text":"订阅 | Folkly"},{"id":"s0002","text":"每周收到一封邮件，讲述文化与地方交汇之处的最新故事。"},{"id":"s0003","text":"Folkly 首页"},{"id":"s0004","text":"folkly"},{"id":"s0005","text":"Folkly 刊物"},{"id":"s0006","text":"文化，送到你手中。"},{"id":"s0007","text":"每周收到一封邮件，讲述文化与地方交汇之处的最新故事。"},{"id":"s0008","text":"电子邮箱"},{"id":"s0009","text":"你@example.com"},{"id":"s0010","text":"此栏请留空"},{"id":"s0011","text":"我同意接收 Folkly 的邮件。"},{"id":"s0012","text":"你的邮箱仅用于发送 Folkly 的更新。地址会被私密保存。启用发送后，邮件中会包含退订链接。"},{"id":"s0013","text":"隐私政策"},{"id":"s0014","text":"。"},{"id":"s0015","text":"订阅"},{"id":"s0016","text":"返回刊物"},{"id":"s0017","text":"隐私政策"},{"id":"s0018","text":"·"},{"id":"s0019","text":"隐私设置"},{"id":"s0020","text":"你的隐私选择"},{"id":"s0021","text":"必要的存储用于支持登录并记住这些选择。可选的分析帮助我们了解刊物的使用情况。广告目前处于关闭状态。"},{"id":"s0022","text":"阅读我们的隐私政策"},{"id":"s0023","text":"允许 Google Analytics"},{"id":"s0024","text":"在配置经过认证的同意提供商之前，广告将保持关闭。"},{"id":"s0025","text":"接受分析"},{"id":"s0026","text":"拒绝可选 Cookie"},{"id":"s0027","text":"管理偏好设置"},{"id":"s0028","text":"保存偏好设置"}]}