{"format":"folkly-translation-v1","slug":"bonwire-kente","locale":"zh-Hans","sourceHash":"39ce07459376ced5d0fd156957cb1a19fcc2023227d30a0dff868e7eae42a86f","glossaryHash":"cc47218883939911ed62c5ed9601d828e2f83ff73ba3ce5b90d6bd7c910f796a","promptVersion":"faithful-public-segments-v1","fallbackLabel":"此页面也可用英语查看。","segments":[{"id":"s0001","text":"加纳邦瓦的肯特织造：身份与生计 | Folkly"},{"id":"s0002","text":"在加纳邦瓦，肯特织造通过不断变化的市场、家庭作坊以及关于该工艺未来的辩论，承载着谚语与身份认同。"},{"id":"s0003","text":"维系之线：邦瓦的肯特、身份认同与生存之战"},{"id":"s0004","text":"在加纳邦瓦，肯特织造通过不断变化的市场、家庭作坊以及关于该工艺未来的辩论，承载着谚语与身份认同。"},{"id":"s0005","text":"一位织工正在邦瓦的木制织机上处理黄色肯特纱线"},{"id":"s0006","text":"跳至内容"},{"id":"s0007","text":"Folkly 首页"},{"id":"s0008","text":"folkly"},{"id":"s0009","text":"主导航"},{"id":"s0010","text":"文化"},{"id":"s0011","text":"档案"},{"id":"s0012","text":"关于"},{"id":"s0013","text":"地点"},{"id":"s0014","text":"订阅"},{"id":"s0015","text":"加纳邦瓦"},{"id":"s0016","text":"维系之线：邦瓦的肯特、身份认同与生存之战"},{"id":"s0017","text":"在加纳邦瓦，肯特织造通过不断变化的市场、家庭作坊以及关于该工艺未来的辩论，承载着谚语与身份认同。"},{"id":"s0018","text":"一位织工正在邦瓦的木制织机上处理黄色肯特纱线"},{"id":"s0019","text":"2019年，邦瓦的肯特织造。"},{"id":"s0020","text":"图片使用详情"},{"id":"s0021","text":"本文内容"},{"id":"s0022","text":"来源与延伸阅读"},{"id":"s0023","text":"所有故事"},{"id":"s0024","text":"穿戴谚语意味着什么？在加纳阿散蒂地区的邦瓦镇，这个问题并非隐喻。在这里，一条布料不仅仅是织物；它是社会历史的图书馆，是地位的标记，也是悬于一线的生计。肯特是由窄条手工织带组装而成的布料，通过连接许多较小的技艺行为形成更大的表面。其织造实践已被列入《人类非物质文化遗产代表作名录》，这一认定于2024年到来。然而，对于坐在这个历史社区的水平织机前的工匠来说，全球认可并不自动转化为经济安全。今天邦瓦的核心张力不在于织物的美感，而在于使其成为可能的材料成本。"},{"id":"s0025","text":"布料的架构"},{"id":"s0026","text":"要理解肯特的分量，必须审视其构造。它不是一块单一的材料，而是一系列窄带的集合，每条宽四英寸或十厘米，在水平条带织机上织成。这些窄带被精心排列并手工缝合在一起，以创建所需尺寸的布料。材料各不相同，包括丝绸、棉花或人造丝，但方法仍根植于特定的劳动分工。联合国教科文组织（UNESCO），即负责教育、科学和文化的联合国机构，描述了纱线、布料和织机生产过程中的不同任务，涉及女性和男性。"},{"id":"s0027","text":"在邦瓦的传统织机上进行肯特织造"},{"id":"s0028","text":"在邦瓦的传统织机上进行肯特织造。"},{"id":"s0029","text":"这种分工不仅仅是功能性的；它是结构性的。其描述还确定了一位首席织工，他帮助协调制作者及其彼此之间以及与买家之间的关系。这种层级化但协作的结构确保了布料保持其完整性和意义。成品并非匿名。它们以谚语、格言和社会情境命名。穿戴者不仅仅是穿上衣物；他们穿上的是信息。使用者的年龄、社会地位和性别影响颜色和图案的选择，使布料成为身份构建和信息传递的载体。"},{"id":"s0030","text":"一项关于邦瓦织工的研究描述了通过家庭纽带、学徒制以及制作者之间的接触来学习"},{"id":"s0031","text":"。"},{"id":"s0032","text":"邦瓦作坊里的木制肯特织机"},{"id":"s0033","text":"邦瓦作坊里的木制肯特织机。"},{"id":"s0034","text":"然而，知识的流动正在扩展。虽然传统的面对面互动和个人联系仍然关键，但社交媒体和在线社交互动在知识流动中日益重要，即使在传统社会中也是如此。这种数字转变使织工能够触及更广泛受众，连接代际，并弥合当地工匠与全球消费者之间的差距。"},{"id":"s0035","text":"尽管具有文化声望和联合国教科文组织的列入名录，邦瓦的织工面临着脆弱的经济现实。主要挑战是进口纱线的高成本。许多织工表达了他们的沮丧，表示他们不能继续依赖昂贵的进口纱线。生产成本的上升使维持该工艺变得越来越困难。"},{"id":"s0036","text":"用于肯特织造的织机"},{"id":"s0037","text":"用于肯特织造的织机。"},{"id":"s0038","text":"作为回应，邦瓦肯特织工呼吁政府建立本地纱线工厂。他们认为，这样的设施不仅会使纱线更实惠，还能为他们的人民创造就业机会。本地工厂将减轻生产成本负担，并帮助织工在市场上竞争。此外，他们要求一个尊重并弘扬其工艺的专用工作空间，相信专用设施将增强创造力和生产力。"},{"id":"s0039","text":"经济压力因假冒和印花肯特面料的涌入而加剧，这些面料大多为进口。这些仿制品正在损害工匠的生计。织工敦促政府禁止或加强对仿制肯特图案的控制，将这种情况描述为对该行业生存的主要威胁。手工织造肯特与机器印花仿制品之间的区别至关重要，不仅关乎质量，更关乎工艺的完整性。"},{"id":"s0040","text":"沃尔塔地区塔菲阿布伊夫的肯特织造"},{"id":"s0041","text":"沃尔塔地区塔菲阿布伊夫的肯特织造。"},{"id":"s0042","text":"2026年2月，邦瓦织工呼吁政府宣布设立国家肯特日"},{"id":"s0043","text":"。织工认为，肯特作为加纳身份、王权和传统的全球公认象征，值得类似的国家级认可。"},{"id":"s0044","text":"他们相信，国家肯特日将确保包容性，提升对本地织造肯特的支持，创造就业，并帮助维持这一代代相传的数百年工艺。这一认可呼吁是更广泛努力的一部分，旨在保护文化遗产，同时倡导保护本地工艺的政策。织工不仅仅是在寻求慈善；他们是在寻求对其在国家文化和经济结构中角色的结构性承认。"},{"id":"s0045","text":"来自沃尔塔地区塔菲的肯特图案"},{"id":"s0046","text":"来自沃尔塔地区塔菲的肯特图案。"},{"id":"s0047","text":"未解决的张力"},{"id":"s0048","text":"邦瓦肯特的故事是关于韧性和适应的，但也是关于未解决张力的。该工艺随着时间推移通过织工的创造力和创新而丰富，但经济条件正在收紧。肯特作为非洲自豪象征的全球认可，并不能自动保护当地工匠免受全球供应链和仿制品的压力。"},{"id":"s0049","text":"织工承载着传统的重量，这既是身份的来源，也是生计的来源。他们公开呼吁建立纱线工厂并保护免受仿制品侵害，使经济压力变得可见。问题依然存在：一个深深植根于当地历史和社会结构的工艺，能否在一个往往重视象征而非实质的全球市场中生存？答案不仅在于织物的美感，更在于支持创造它的织工的政策。"},{"id":"s0050","text":"来自沃尔塔地区的肯特图案"},{"id":"s0051","text":"来自沃尔塔地区的肯特图案。"},{"id":"s0052","text":"一条带，一个图案，一个决定"},{"id":"s0053","text":"仔细观察肯特会改变注意力的尺度。成品布料呈现较大的排列，而组成它的织带则揭示了织机上的重复决定。联合国教科文组织的描述确定了织造技术、图案与布料社会意义之间的关系。"},{"id":"s0054","text":"因此，图案不仅仅是从远处识别的东西。它也是通过一系列熟练动作执行的工作的结果。"},{"id":"s0055","text":"这种关系使作者身份变得重要。知道一块布料是肯特，并不能告诉读者谁制作了特定的一件，其生产花了多长时间，或为什么选择其图案。这些细节取决于制作者和场合。广泛的文化描述可以介绍该实践，但特定物体值得更具体的描述。命名织工并承认他们的决定，是将布料视为工作而非匿名遗产的一部分。"},{"id":"s0056","text":"2024年邦瓦肯特节"},{"id":"s0057","text":"2024年邦瓦肯特节。"},{"id":"s0058","text":"材料供应的问题属于该描述的一部分。只有当人们能够获得所需物品并找到继续投入时间的理由时，织机才能保持使用。保护工艺的名声和维持其工作条件是相关的任务，但它们并不相同。一个受庆祝的文化名称可以广泛传播，而实践它的人仍然面临近在咫尺的实际限制。"},{"id":"s0059","text":"传承也需要空间让人变得胜任。成品纺织品并不暴露制作过程中发生的每一次调整、错误或判断。学习涉及与知识一起工作，然后尝试使该知识可用。肯特的连续性取决于这些机会，以及节日、收藏或国际遗产名录中的认可。图案的未来与织机前的人的未来相连。"},{"id":"s0060","text":"加纳北部地区的肯特织造"},{"id":"s0061","text":"加纳北部地区的肯特织造。"},{"id":"s0062","text":"同样的注意力可以塑造读者接近照片的方式。在将图案视为象征之前，寻找织机、纱线和从事工作的人之间的关系。来自另一个加纳织造社区的背景图像应命名该社区。更广泛的实践有许多家园，承认这些差异增强了邦瓦的描述，而不是削弱它。"},{"id":"s0063","text":"相关故事"},{"id":"s0064","text":"特奥蒂特兰德尔瓦列 Porfirio Gutierrez 家庭作坊中的木制织机和彩色羊毛团"},{"id":"s0065","text":"一种活的语言色彩。"},{"id":"s0066","text":"瓦哈卡的家庭知识与纺织品发明。"},{"id":"s0067","text":"德岛 Furusho 染坊的外观和日文招牌"},{"id":"s0068","text":"蓝色的重量：德岛的靛蓝、劳动与活的经济"},{"id":"s0069","text":"熟练劳动与靛蓝染色的经济学。"},{"id":"s0070","text":"塔拉戈纳 castells 比赛中，一座人塔从人群中升起"},{"id":"s0071","text":"广场的重量：塔拉戈纳的 Castells"},{"id":"s0072","text":"在加泰罗尼亚塔拉戈纳，castells 将人塔转化为公共广场上信任、训练和归属感的共享实践。"},{"id":"s0073","text":"Juan Atkins、Derrick May 和 Kevin Saunderson 在底特律共济会神庙同台表演"},{"id":"s0074","text":"未来有着底特律的频率。"},{"id":"s0075","text":"一个无线电信号，一个朋友圈，以及倾听联系的意愿：底特律技术音乐背后的文化条件超越了机器的熟悉故事。"},{"id":"s0076","text":"folkly"},{"id":"s0077","text":"关于文化与地点交汇的故事。"},{"id":"s0078","text":"页脚导航"},{"id":"s0079","text":"文化"},{"id":"s0080","text":"档案"},{"id":"s0081","text":"关于 Folkly"},{"id":"s0082","text":"Then Media inc. 的项目。"},{"id":"s0083","text":"词语、地点以及赋予它们意义的人们。"},{"id":"s0084","text":"隐私政策"},{"id":"s0085","text":"·"},{"id":"s0086","text":"隐私设置"},{"id":"s0087","text":"您的隐私选择"},{"id":"s0088","text":"基本存储支持登录并记住这些选择。可选分析帮助我们了解期刊的使用情况。广告目前已禁用。"},{"id":"s0089","text":"阅读我们的隐私政策"},{"id":"s0090","text":"允许 Google 分析"},{"id":"s0091","text":"在配置经过认证的同意提供商之前，广告保持关闭。"},{"id":"s0092","text":"接受分析"},{"id":"s0093","text":"拒绝可选 Cookie"},{"id":"s0094","text":"管理偏好"},{"id":"s0095","text":"保存偏好"}]}