{"format":"folkly-translation-v1","slug":"ui-about","locale":"ja","sourceHash":"a530cdfa18dd3f41f2110239bf13f4eb13b1d2acea9ceb0490f66ec5cf0563b0","glossaryHash":"cc47218883939911ed62c5ed9601d828e2f83ff73ba3ce5b90d6bd7c910f796a","promptVersion":"faithful-public-segments-v1","fallbackLabel":"このページは英語でもご覧いただけます。","segments":[{"id":"s0001","text":"Folkly について — 文化と場所"},{"id":"s0002","text":"文化と場所をめぐるジャーナル、Folkly へようこそ。編集方針をご覧いただき、ストーリーを提案したり、寄稿者になったりしてください。"},{"id":"s0003","text":"Folkly について — 文化と場所"},{"id":"s0004","text":"文化と場所をめぐるジャーナル、Folkly へようこそ。編集方針をご覧いただき、ストーリーを提案したり、寄稿者になったりしてください。"},{"id":"s0005","text":"本文へ進む"},{"id":"s0006","text":"Folkly ホーム"},{"id":"s0007","text":"folkly"},{"id":"s0008","text":"メインナビゲーション"},{"id":"s0009","text":"文化"},{"id":"s0010","text":"アーカイブ"},{"id":"s0011","text":"Folkly について"},{"id":"s0012","text":"場所"},{"id":"s0013","text":"購読"},{"id":"s0014","text":"Folkly について"},{"id":"s0015","text":"文化と場所が交わるところをめぐる"},{"id":"s0016","text":"ストーリー。"},{"id":"s0017","text":"パレードひとつ、織物の技法ひとつ、音楽シーンひとつ。そのそれぞれが、人々と歴史と帰属をめぐるストーリーを開きます。Folkly は、ある場所を特徴づけるもの、そしてその文化生活が育ち、変わり、続いていく条件を探ります。"},{"id":"s0018","text":"このジャーナルは、Noah Rappaport の Creative Cities プロジェクトから生まれました。クリエイティブディレクションとシステム思考での仕事が、日常の表現の下にある関係への好奇心を育てています。誰がそれを作り、何がそれを支え、それがほかの人々に何を可能にするのか。"},{"id":"s0019","text":"アイデンティティとは、作り続けられるものです。"},{"id":"s0020","text":"Noah のフレームワーク、"},{"id":"s0021","text":"困難をへた適応的アイデンティティ"},{"id":"s0022","text":"は、コミュニティが変化にどう応え、受け継いだアイデンティティをどう自分のものにするかを問います。新しい技術、経済的圧力、ほかの文化との出会いは、慣れ親しんだ生き方を揺さぶることがあります。人々は何を守り、何を借り、何を作り出すかを交渉します。"},{"id":"s0023","text":"適応的アイデンティティのサイクル"},{"id":"s0024","text":"つながれた五つの局面が、こうした問いへの入り口を与えてくれます。すべてのコミュニティが順にたどるべき手順ではなく、問いを立てるためのものです。"},{"id":"s0025","text":"01"},{"id":"s0026","text":"出会いと変動"},{"id":"s0027","text":"変わっていく環境が、慣れ親しんだ生き方を新しい状況と出会わせる。"},{"id":"s0028","text":"02"},{"id":"s0029","text":"アイデンティティの交渉"},{"id":"s0030","text":"人々は何が自分たちのものかを見直す。外からの影響を取り入れたり、意味のある違いを守ったりする。"},{"id":"s0031","text":"03"},{"id":"s0032","text":"創造的な応答"},{"id":"s0033","text":"音楽、食べ物、技芸、儀礼、デザイン、そして実用的な発明が、応答にその形を与える。"},{"id":"s0034","text":"04"},{"id":"s0035","text":"定着"},{"id":"s0036","text":"繰り返され、伝えられ、支えられるなかで、新しい営みは日常の一部になっていく。"},{"id":"s0037","text":"05"},{"id":"s0038","text":"更新されたアイデンティティ"},{"id":"s0039","text":"変わった理解は、次の世代が前へ進められる遺産になる。"},{"id":"s0040","text":"このワーキングセオリーでは困難が中心にありますが、苦しさが成長を保証するわけではありません。その重さ、得られる支援、失われる可能性のすべてが意味を持ちます。創造的な営みは、実用的な必要を満たし、帰属を深め、同時に新しい問いを開くことがあります。それは重なり合う目的であって、文化の上下関係ではありません。"},{"id":"s0041","text":"ストーリーの approach"},{"id":"s0042","text":"特定の場所と営みから始めます。どんな人々、関係、資源、歴史がそれを可能にしているかを問います。私たちのエッセイは出典を結びつけ、記録された歴史と解釈とを区別します。土地の言葉には文脈を与え、コミュニティ内部の違いも物語の一部として残します。"},{"id":"s0043","text":"人々と証拠は、このフレームワークに挑戦することもあります。問いは開かれたままです。コミュニティは何を次へと引き継ぎ、それが何を可能にするのか。"},{"id":"s0044","text":"次のストーリーを一緒に"},{"id":"s0045","text":"Folkly は、土地の文化や技芸、音楽、そして場所を形づくる人々を知る寄稿者を探しています。ストーリーのアイデアや訂正の提案、贡献したい方法をお聞かせください。"},{"id":"s0046","text":"お名前"},{"id":"s0047","text":"メールアドレス"},{"id":"s0048","text":"ご用件は何ですか?"},{"id":"s0049","text":"理由を選んでください"},{"id":"s0050","text":"ストーリーを提案"},{"id":"s0051","text":"訂正を依頼"},{"id":"s0052","text":"寄稿者になりたい"},{"id":"s0053","text":"パートナーシップについて相談"},{"id":"s0054","text":"その他"},{"id":"s0055","text":"寄稿者になることに興味があります。"},{"id":"s0056","text":"メッセージ"},{"id":"s0057","text":"10〜3,000文字。機密性の高い個人情報は含めないでください。"},{"id":"s0058","text":"この欄は空欄のままにしてください"},{"id":"s0059","text":"この問い合わせへの回答のため、Folkly が私の連絡先とメッセージを非公開で保存することに同意します。これによってニュースレターを購読することにはなりません。"},{"id":"s0060","text":"メッセージを送信"},{"id":"s0061","text":"folkly"},{"id":"s0062","text":"文化と場所が交わるところをめぐるストーリー。"},{"id":"s0063","text":"フッターナビゲーション"},{"id":"s0064","text":"文化"},{"id":"s0065","text":"アーカイブ"},{"id":"s0066","text":"Folkly について"},{"id":"s0067","text":"Then Media inc. のプロジェクト。"},{"id":"s0068","text":"言葉、場所、そしてそれに意味を与える人々。"},{"id":"s0069","text":"プライバシーポリシー"},{"id":"s0070","text":"・"},{"id":"s0071","text":"プライバシー設定"},{"id":"s0072","text":"あなたのプライバシーに関する選択"},{"id":"s0073","text":"必須のストレージはサインインを支え、これらの選択を記憶します。オプションのアナリティクスは、このジャーナルがどのように使われているかを理解するのに役立ちます。広告は現在オフになっています。"},{"id":"s0074","text":"プライバシーポリシーを読む"},{"id":"s0075","text":"Google Analytics を許可する"},{"id":"s0076","text":"認定済みの同意プロバイダーが設定されるまで、広告はオフのままになります。"},{"id":"s0077","text":"アナリティクスを許可"},{"id":"s0078","text":"オプションの cookie を拒否"},{"id":"s0079","text":"設定を管理"},{"id":"s0080","text":"設定を保存"}]}