{"format":"folkly-translation-v1","slug":"ui-privacy","locale":"zh-Hans","sourceHash":"2a4355bda7d17485d4333d07a43cc62b54374ac17303cca7ac98988b2f61177e","glossaryHash":"cc47218883939911ed62c5ed9601d828e2f83ff73ba3ce5b90d6bd7c910f796a","promptVersion":"faithful-public-segments-v1","fallbackLabel":"此页面也有英文版本。","segments":[{"id":"s0001","text":"隐私政策 | Folkly"},{"id":"s0002","text":"了解 Folkly 如何处理订阅、联系消息、Cookie 与隐私选择。"},{"id":"s0003","text":"folkly"},{"id":"s0004","text":"隐私政策"},{"id":"s0005","text":"2026年10月8日起生效。Folkly 是 Then Media inc. 的项目。联系"},{"id":"s0006","text":"noah@then.tv"},{"id":"s0007","text":"咨询隐私问题或提出请求。"},{"id":"s0008","text":"你提供的信息"},{"id":"s0009","text":"订阅会收集你的电子邮箱、同意记录和订阅状态,用于每周的故事更新。联系表单会收集你的姓名、邮箱、联系原因、留言和寄稿意向,以便我们回复。请勿在表单中填写敏感个人信息。联系我们并不会让你订阅邮件通讯。"},{"id":"s0010","text":"信息的存储与使用"},{"id":"s0011","text":"订阅者与联系记录保存在 Vercel Blob 私有存储中。Vercel 托管本站,并处理交付与安全所需的运行请求信息。Supabase 提供所有者身份验证和私密的编辑存储。Resend 是已配置的通讯发送服务;发送取决于激活与经验证的发件人设置。这些服务商为相应服务处理信息。部分署名图片通过 Wikimedia 图片服务器交付,服务器会收到显示所需的请求。外部来源与音乐链接指向各自遵循自身隐私惯例的网站。我们不会向 Google Analytics 或广告标签提供订阅者或联系记录。"},{"id":"s0012","text":"Cookie、分析与广告"},{"id":"s0013","text":"登录所必需的 Cookie 支持私密的站长专区。浏览器的本地偏好会保存你对可选 Cookie 的决定,最长180天。Google Analytics(GA4)仅在你允许分析时加载;它衡量访问与互动,并可能使用标识符和 Cookie。URL 查询串与片段不会进入我们最初的页面浏览配置。分析不会在站长面板中加载。我们在站点的分析配置中停用了 Google 信号与广告个性化信号。"},{"id":"s0014","text":"广告脚本目前处于屏蔽状态,等待配置经过认证的同意提供商。如果启用 Google 广告,Google 及已披露的其他广告合作伙伴可能使用 Cookie,依据你的适用选择,基于你此前对本站及其他网站的访问来投放广告。启用前必须更新本政策与同意界面。参见"},{"id":"s0015","text":"Google 如何使用来自合作网站的信息"},{"id":"s0016","text":"与"},{"id":"s0017","text":"Google 的广告选择"},{"id":"s0018","text":"。"},{"id":"s0019","text":"你的选择"},{"id":"s0020","text":"在任何公开页面使用“隐私设置”可拒绝可选 Cookie 或更改分析同意。拒绝后刊物仍可正常使用。撤回同意会重新加载页面,停止站点的分析标签,并尝试清除可访问的分析 Cookie;它无法删除 Google 已处理的数据。本站点保持广告关闭,包括存在全球隐私控制(Global Privacy Control)信号时。启用发送后,通讯邮件会包含退订链接。你可以发邮件至上述地址,请求访问、更正或删除你提供的信息;在提供记录之前我们可能会核实该请求。"},{"id":"s0021","text":"保留与保护"},{"id":"s0022","text":"订阅记录在订阅有效期间保留。为处理退订请求,可能保留最低限度的抑制信息。联系与编辑记录在其用途所需期间保留,并受删除请求及正当的安全或法律需要约束。目前未实施自动删除计划。我们限制对私密记录的访问,但没有任何在线系统可以保证绝对安全。服务商可能在你所在国家/地区之外处理信息。"},{"id":"s0023","text":"站长编辑对话"},{"id":"s0024","text":"站长的私密工作区将文章创意与编辑对话保存在 Vercel Blob 私有存储中。启用并使用编辑对话时,站长的消息与有限的近期对话历史会发送给 OpenAI 以生成回复。公开读者表单的提交内容不会自动包含在这些对话中。"},{"id":"s0025","text":"儿童与变更"},{"id":"s0026","text":"本刊物面向一般受众,我们不会有意收集13岁以下儿童的个人信息。如有儿童提供了信息,请联系我们。做法变更时我们会更新此页面;同意政策变化时,我们会重新征求你对可选 Cookie 的选择。"},{"id":"s0027","text":"隐私政策"},{"id":"s0028","text":"·"},{"id":"s0029","text":"隐私设置"},{"id":"s0030","text":"你的隐私选择"},{"id":"s0031","text":"必要的存储用于支持登录并记住这些选择。可选的分析帮助我们了解刊物的使用情况。广告目前处于关闭状态。"},{"id":"s0032","text":"阅读我们的隐私政策"},{"id":"s0033","text":"允许 Google Analytics"},{"id":"s0034","text":"在配置经过认证的同意提供商之前,广告将保持关闭。"},{"id":"s0035","text":"接受分析"},{"id":"s0036","text":"拒绝可选 Cookie"},{"id":"s0037","text":"管理偏好设置"},{"id":"s0038","text":"保存偏好设置"}]}