{"format":"folkly-translation-v1","slug":"ui-subscribe","locale":"hi","sourceHash":"aa3edaf40da4e86ad48a6906a246af04f1cb33641053b1d53b2aef9b15731994","glossaryHash":"cc47218883939911ed62c5ed9601d828e2f83ff73ba3ce5b90d6bd7c910f796a","promptVersion":"faithful-public-segments-v1","fallbackLabel":"यह पृष्ठ अंग्रेज़ी में भी उपलब्ध है।","segments":[{"id":"s0001","text":"सदस्यता लें | Folkly"},{"id":"s0002","text":"संस्कृति और स्थान के संगम पर नई कहानियों के साथ साप्ताहिक ईमेल प्राप्त करें।"},{"id":"s0003","text":"Folkly होम"},{"id":"s0004","text":"folkly"},{"id":"s0005","text":"Folkly पत्रिका"},{"id":"s0006","text":"संस्कृति, आपके पास।"},{"id":"s0007","text":"संस्कृति और स्थान के संगम पर नई कहानियों के साथ साप्ताहिक ईमेल प्राप्त करें।"},{"id":"s0008","text":"ईमेल पता"},{"id":"s0009","text":"आप@example.com"},{"id":"s0010","text":"इस फ़ील्ड को खाली छोड़ दें"},{"id":"s0011","text":"मैं Folkly के ईमेल प्राप्त करने की सहमति देता हूँ।"},{"id":"s0012","text":"हम आपका ईमेल Folkly के अपडेट के लिए उपयोग करते हैं। आपका पता निजी रूप से संग्रहित रहता है। भेजना सक्रिय होने पर ईमेल में सदस्यता हटाने का लिंक शामिल होता है।"},{"id":"s0013","text":"गोपनीयता नीति"},{"id":"s0014","text":"।"},{"id":"s0015","text":"सदस्यता लें"},{"id":"s0016","text":"पत्रिका पर वापस जाएँ"},{"id":"s0017","text":"गोपनीयता नीति"},{"id":"s0018","text":"·"},{"id":"s0019","text":"गोपनीयता सेटिंग्स"},{"id":"s0020","text":"आपकी गोपनीयता संबंधी पसंद"},{"id":"s0021","text":"आवश्यक स्टोरेज साइन-इन को समर्थन देता है और इन पसंदों को याद रखता है। वैकल्पिक एनालिटिक्स हमें यह समझने में मदद करता है कि पत्रिका का उपयोग कैसे किया जाता है। विज्ञापन अभी बंद हैं।"},{"id":"s0022","text":"हमारी गोपनीयता नीति पढ़ें"},{"id":"s0023","text":"Google Analytics की अनुमति दें"},{"id":"s0024","text":"प्रमाणित सहमति प्रदाता के कॉन्फ़िगर होने तक विज्ञापन बंद रहेंगे।"},{"id":"s0025","text":"एनालिटिक्स स्वीकारें"},{"id":"s0026","text":"वैकल्पिक कुकीज़ अस्वीकारें"},{"id":"s0027","text":"प्राथमिकताएँ प्रबंधित करें"},{"id":"s0028","text":"प्राथमिकताएँ सहेजें"}]}