{"format":"folkly-translation-v1","slug":"ui-messages","locale":"fr","sourceHash":"040f26760d8be9f7bb702a58a4e48ec4adaa96e88175b241bcb46e1f00ba6131","glossaryHash":"cc47218883939911ed62c5ed9601d828e2f83ff73ba3ce5b90d6bd7c910f796a","promptVersion":"faithful-public-segments-v1","fallbackLabel":"Cette page est également disponible en anglais.","segments":[{"id":"s0001","text":"Affichage de {shown} sur {total} {noun}"},{"id":"s0002","text":"récit"},{"id":"s0003","text":"récits"},{"id":"s0004","text":"Global Privacy Control détecté. La publicité reste désactivée ; l'analyse est un choix optionnel distinct."},{"id":"s0005","text":"Enregistrement de votre message…"},{"id":"s0006","text":"Merci. Votre message a été enregistré pour Folkly."},{"id":"s0007","text":"Vérifiez votre nom, votre e-mail, la raison, le message et le consentement, puis réessayez."},{"id":"s0008","text":"Le contact est temporairement indisponible. Veuillez réessayer plus tard."},{"id":"s0009","text":"Impossible de se connecter. Votre message n'a pas été confirmé comme enregistré. Veuillez réessayer."},{"id":"s0010","text":"Enregistrement de votre abonnement…"},{"id":"s0011","text":"Merci. Votre abonnement a été enregistré."},{"id":"s0012","text":"Vérifiez votre adresse e-mail et votre consentement, puis réessayez."},{"id":"s0013","text":"L'abonnement est temporairement indisponible. Veuillez réessayer plus tard."},{"id":"s0014","text":"Impossible de se connecter. Veuillez réessayer."}]}