{"format":"folkly-translation-v1","slug":"ui-messages","locale":"hi","sourceHash":"040f26760d8be9f7bb702a58a4e48ec4adaa96e88175b241bcb46e1f00ba6131","glossaryHash":"cc47218883939911ed62c5ed9601d828e2f83ff73ba3ce5b90d6bd7c910f796a","promptVersion":"faithful-public-segments-v1","fallbackLabel":"यह पृष्ठ अंग्रेज़ी में भी उपलब्ध है।","segments":[{"id":"s0001","text":"{total} में से {shown} {noun} दिखाया जा रहा है"},{"id":"s0002","text":"कहानी"},{"id":"s0003","text":"कहानियाँ"},{"id":"s0004","text":"ग्लोबल प्राइवेसी कंट्रोल का पता चला। विज्ञापन अक्षम रहेंगे; विश्लेषण एक अलग वैकल्पिक विकल्प है।"},{"id":"s0005","text":"आपका संदेश सहेजा जा रहा है…"},{"id":"s0006","text":"धन्यवाद। आपका संदेश Folkly के लिए सहेजा गया है।"},{"id":"s0007","text":"अपना नाम, ईमेल, कारण, संदेश और सहमति जांचें, फिर पुनः प्रयास करें।"},{"id":"s0008","text":"संपर्क अस्थायी रूप से अनुपलब्ध है। कृपया बाद में पुनः प्रयास करें।"},{"id":"s0009","text":"कनेक्ट नहीं हो सका। आपका संदेश सहेजा गया है, इसकी पुष्टि नहीं हुई है। कृपया पुनः प्रयास करें।"},{"id":"s0010","text":"आपकी सदस्यता सहेजी जा रही है…"},{"id":"s0011","text":"धन्यवाद। आपकी सदस्यता सहेजी गई है।"},{"id":"s0012","text":"अपना ईमेल पता और सहमति जांचें, फिर पुनः प्रयास करें।"},{"id":"s0013","text":"सदस्यता अस्थायी रूप से अनुपलब्ध है। कृपया बाद में पुनः प्रयास करें।"},{"id":"s0014","text":"कनेक्ट नहीं हो सका। कृपया पुनः प्रयास करें।"}]}