{"format":"folkly-translation-v1","slug":"ui-about","locale":"zh-Hans","sourceHash":"a530cdfa18dd3f41f2110239bf13f4eb13b1d2acea9ceb0490f66ec5cf0563b0","glossaryHash":"cc47218883939911ed62c5ed9601d828e2f83ff73ba3ce5b90d6bd7c910f796a","promptVersion":"faithful-public-segments-v1","fallbackLabel":"此页面也有英文版本。","segments":[{"id":"s0001","text":"关于 Folkly — 文化与地方"},{"id":"s0002","text":"认识 Folkly,一本关于文化与地方的刊物。了解我们的编辑视角,推荐一个故事,或成为寄稿人。"},{"id":"s0003","text":"关于 Folkly — 文化与地方"},{"id":"s0004","text":"认识 Folkly,一本关于文化与地方的刊物。了解我们的编辑视角,推荐一个故事,或成为寄稿人。"},{"id":"s0005","text":"跳到正文"},{"id":"s0006","text":"Folkly 首页"},{"id":"s0007","text":"folkly"},{"id":"s0008","text":"主导航"},{"id":"s0009","text":"文化"},{"id":"s0010","text":"档案"},{"id":"s0011","text":"关于"},{"id":"s0012","text":"地方"},{"id":"s0013","text":"订阅"},{"id":"s0014","text":"关于 Folkly"},{"id":"s0015","text":"关于文化与地方"},{"id":"s0016","text":"交汇之处的故事。"},{"id":"s0017","text":"一场游行、一门织造手艺、一个音乐场景:每一个都开启一段关于人、历史与归属的故事。Folkly 探索是什么让一个地方与众不同,又是什么让它的文化生活得以生长、变化与延续。"},{"id":"s0018","text":"这本刊物源自 Noah Rappaport 的 Creative Cities 项目。他在创意指导与系统思考方面的工作,滋养了对日常表达之下种种关系的好奇:谁在创造,什么在维系,它又为他人开启了什么。"},{"id":"s0019","text":"身份是不断被创造的东西。"},{"id":"s0020","text":"Noah 的框架,"},{"id":"s0021","text":"经由磨砺的适应性身份"},{"id":"s0022","text":",追问社区如何回应变化,把继承来的身份变成自己的。一项新技术、一种经济压力、一次与其他文化的相遇,都可能动摇熟悉的生活方式。人们在协商:保留什么,借用什么,创造什么。"},{"id":"s0023","text":"适应性身份的循环"},{"id":"s0024","text":"五个相互关联的时刻提供了进入这些问题的一扇门。它们是探究的起点,而不是每个社区都必须遵循的顺序。"},{"id":"s0025","text":"01"},{"id":"s0026","text":"相遇与冲击"},{"id":"s0027","text":"变化中的环境,让熟悉的生活方式与新的条件相遇。"},{"id":"s0028","text":"02"},{"id":"s0029","text":"身份协商"},{"id":"s0030","text":"人们重新审视什么属于自己:吸收外来影响,或守护有意义的差异。"},{"id":"s0031","text":"03"},{"id":"s0032","text":"创造性回应"},{"id":"s0033","text":"音乐、饮食、手艺、仪式、设计与实用发明,赋予回应以形式。"},{"id":"s0034","text":"04"},{"id":"s0035","text":"融合"},{"id":"s0036","text":"新的实践经过重复、传授与支持,成为日常生活的一部分。"},{"id":"s0037","text":"05"},{"id":"s0038","text":"身份的更新"},{"id":"s0039","text":"改变了的理解,成为下一代可以继续传承的遗产。"},{"id":"s0040","text":"磨砺是这一工作理论的核心,但苦难本身并不保证成长。它的烈度、可获得的支持、失去的可能性,都同样重要。创造性的活动可以同时满足实际需要、深化归属感、开启新的问题;这些是彼此重叠的目的,而非文化的等级。"},{"id":"s0041","text":"我们如何着手一个故事"},{"id":"s0042","text":"从具体的地方与实践出发。追问是哪些人、关系、资源与历史让它成为可能。我们的文章链接出处,并区分有据可查的历史与诠释。地方性的词语获得语境,社区内部的差异也始终是故事的一部分。"},{"id":"s0043","text":"人与证据都可能挑战这个框架。问题始终敞开:一个社区传承着什么,又让什么成为可能?"},{"id":"s0044","text":"参与讲述下一个故事"},{"id":"s0045","text":"Folkly 正在寻找了解地方文化、手艺、音乐,以及塑造一个地方的人们 的寄稿人。分享一个故事创意、提出一处更正,或告诉我们你想如何参与。"},{"id":"s0046","text":"你的姓名"},{"id":"s0047","text":"电子邮箱"},{"id":"s0048","text":"你为什么联系 Folkly?"},{"id":"s0049","text":"选择一个原因"},{"id":"s0050","text":"推荐一个故事"},{"id":"s0051","text":"请求更正"},{"id":"s0052","text":"成为寄稿人"},{"id":"s0053","text":"洽谈合作"},{"id":"s0054","text":"其他"},{"id":"s0055","text":"我有兴趣成为寄稿人。"},{"id":"s0056","text":"你的留言"},{"id":"s0057","text":"10–3,000 字。请勿包含敏感个人信息。"},{"id":"s0058","text":"此栏请留空"},{"id":"s0059","text":"我同意 Folkly 私密保存我的联系方式与留言,以便回复此咨询。这不会让我订阅邮件通讯。"},{"id":"s0060","text":"发送留言"},{"id":"s0061","text":"folkly"},{"id":"s0062","text":"关于文化与地方交汇之处的故事。"},{"id":"s0063","text":"页脚导航"},{"id":"s0064","text":"文化"},{"id":"s0065","text":"档案"},{"id":"s0066","text":"关于 Folkly"},{"id":"s0067","text":"Then Media inc. 项目。"},{"id":"s0068","text":"词语、地方,以及赋予它们意义的人。"},{"id":"s0069","text":"隐私政策"},{"id":"s0070","text":"·"},{"id":"s0071","text":"隐私设置"},{"id":"s0072","text":"你的隐私选择"},{"id":"s0073","text":"必要的存储用于支持登录并记住这些选择。可选的分析帮助我们了解刊物的使用情况。广告目前处于关闭状态。"},{"id":"s0074","text":"阅读我们的隐私政策"},{"id":"s0075","text":"允许 Google Analytics"},{"id":"s0076","text":"在配置经过认证的同意提供商之前,广告将保持关闭。"},{"id":"s0077","text":"接受分析"},{"id":"s0078","text":"拒绝可选 Cookie"},{"id":"s0079","text":"管理偏好设置"},{"id":"s0080","text":"保存偏好设置"}]}