{"format":"folkly-translation-v1","slug":"ui-messages","locale":"ar","sourceHash":"040f26760d8be9f7bb702a58a4e48ec4adaa96e88175b241bcb46e1f00ba6131","glossaryHash":"cc47218883939911ed62c5ed9601d828e2f83ff73ba3ce5b90d6bd7c910f796a","promptVersion":"faithful-public-segments-v1","fallbackLabel":"هذه الصفحة متاحة أيضاً باللغة الإنجليزية.","segments":[{"id":"s0001","text":"عرض {shown} من {total} {noun}"},{"id":"s0002","text":"قصة"},{"id":"s0003","text":"قصص"},{"id":"s0004","text":"تم اكتشاف Global Privacy Control. تبقى الإعلانات معطلة؛ التحليلات خيار اختياري منفصل."},{"id":"s0005","text":"جارٍ حفظ رسالتك…"},{"id":"s0006","text":"شكرًا لك. تم حفظ رسالتك لفولكلي."},{"id":"s0007","text":"تحقق من اسمك وبريدك الإلكتروني وسببك ورسالتك وموافقتك، ثم حاول مرة أخرى."},{"id":"s0008","text":"التواصل غير متاح مؤقتًا. يرجى المحاولة مرة أخرى لاحقًا."},{"id":"s0009","text":"تعذر الاتصال. لم يتم تأكيد حفظ رسالتك. يرجى المحاولة مرة أخرى."},{"id":"s0010","text":"جارٍ حفظ اشتراكك…"},{"id":"s0011","text":"شكرًا لك. تم حفظ اشتراكك."},{"id":"s0012","text":"تحقق من عنوان بريدك الإلكتروني وموافقتك، ثم حاول مرة أخرى."},{"id":"s0013","text":"الاشتراك غير متاح مؤقتًا. يرجى المحاولة مرة أخرى لاحقًا."},{"id":"s0014","text":"تعذر الاتصال. يرجى المحاولة مرة أخرى."}]}